S.NO,Video Title,Video_link,Views,Uploaded,Channel Name,Channel Link
1,Sabse Bada Sawal | 2024 की लड़ाई…कांग्रेस कर पाएगी अगुवाई ? देखिए Sandeep Chaudhary के साथ LIVE,https://www.youtube.com/watch?v=XWVCFaAwl_0,198K views,Streamed 22 hours ago,News24,https://www.youtube.com/c/News24youtube
2,News24 LIVE | Jharkhand Political Crisis | CBI Raid on Manish Sisodia | Hemant Soren | Hindi News,https://www.youtube.com/watch?v=z6qO20Jx5FI,1.7K watching,NA,News24,https://www.youtube.com/c/News24youtube
3,Rashtra Ki Baat: Akhilesh Yadav क्यों बोले- UP से तय होगा 2024? Manak Gupta के साथ I News24 LIVE,https://www.youtube.com/watch?v=9oamVsrbLpc,246K views,Streamed 1 day ago,News24,https://www.youtube.com/c/News24youtube
4,"Akhilesh Yadav का Yogi सरकार पर हमला, बोले- Twin Tower की तरह 2024 में ढह जाएगी BJP सरकार...",https://www.youtube.com/watch?v=vJjodY4h8s0,556 watching,NA,News24,https://www.youtube.com/c/News24youtube
5,Rashtra Ki Baat | Congress अध्यक्ष की रेस में कूदेंगे Shashi Tharoor ? Manak Gupta I News24 LIVE,https://www.youtube.com/watch?v=fcMHIJybE2s,51K views,Streamed 8 minutes ago,News24,https://www.youtube.com/c/News24youtube
6,4 बजे 24 Reporter | Hindi News | Latest News | Top News | Today's News | News24,https://www.youtube.com/watch?v=Z7ppUHl7cYI,4.5K views,Streamed 1 hour ago,News24,https://www.youtube.com/c/News24youtube
7,Rashtra Ki Baat: फिर दिल्ली क्यों आए किसान ? Manak Gupta | Rakesh Tikait | Farmers Protest I LIVE,https://www.youtube.com/watch?v=1MjlCKmU34Q,409K views,Streamed 8 days ago,News24,https://www.youtube.com/c/News24youtube
8,"IND Vs PAK: King Kohli is Back! कोहली की पारी ने Team India को जिताया, Pakistan को रोमांचक मैच हराया",https://www.youtube.com/watch?v=hFohtnUi7cc,221K views,1 day ago,News24 Sports,https://www.youtube.com/c/News24Sports
9,Sabse Bada Sawal | बिहार की लड़ाई...भ्रष्टाचार पर आई ! देखिये Sandeep Chaudhary के साथ LIVE,https://www.youtube.com/watch?v=J5U9E18NTyk,561K views,Streamed 2 weeks ago,News24,https://www.youtube.com/c/News24youtube
10,WATCH | 'I am not fighting to stay in Alexandra' - Malema defends Ibiza partying,https://www.youtube.com/watch?v=4U9tmRUbL5s,72K views,2 days ago,News24,https://www.youtube.com/user/News24Video
11,Siasat International News 24th Aug 2022,https://www.youtube.com/watch?v=0SZQOdu1A_0,393K views,5 days ago,Siasat Daily,https://www.youtube.com/c/SiasatDailyNews
12,Rashtra Ki Baat : 24 में Modi के सामने कौन | Kejriwal | Mamata Banerjee | Nitish | Manak Gupta,https://www.youtube.com/watch?v=QdPdaGXiMzs,315K views,Streamed 9 days ago,News24,https://www.youtube.com/c/News24youtube
13,2 PM News Bulletin | 26 Aug 2022 | Ghulam Nabi Azad Quits Congress | Hindi News || News24,https://www.youtube.com/watch?v=SFg3b2IKFyk,16K views,Streamed 4 days ago,News24,https://www.youtube.com/c/News24youtube
14,देखिये News 24 टीम के साथ सपा सुप्रीमो Akhilesh Yadav EXCLUSIVE I News24 LIVE,https://www.youtube.com/watch?v=rVKNe2HU4Vw,215K views,Streamed 2 days ago,News24,https://www.youtube.com/c/News24youtube
15,"Bihar: Tejashwi Yadav की चेतावनी; कहा- ADM ने क्यों उठाई लाठी?, कार्रवाई होगी",https://www.youtube.com/watch?v=jGc_-tOx04Y,1.9M views,7 days ago,News24,https://www.youtube.com/c/News24youtube
16,आज गिराया जाएगा भ्रष्टाचार का TOWER ! क्यों हुआ…कैसे हुआ…क्या बच सकता था TWIN TOWER ?,https://www.youtube.com/watch?v=vygku4uf8Kk,13K views,Streamed 2 days ago,News24,https://www.youtube.com/c/News24youtube
17,"Tejashwi Yadav का Vidhan Sabha में बहुमत साबित करने से पहले भाषण, BJP ने घेरा...",https://www.youtube.com/watch?v=ngkZtN8VrXA,354K views,Streamed 5 days ago,News24,https://www.youtube.com/c/News24youtube
18,Sabse Bada Sawal | रोहिंग्या की लड़ाई राष्ट्रीय सुरक्षा पर आई? | Sandeep Chaudhari,https://www.youtube.com/watch?v=c5iWjRwj9rg,161K views,Streamed 11 days ago,News24,https://www.youtube.com/c/News24youtube
19,Noida Twin Tower Demolition LIVE | Supertech का अवैध Twin Tower ध्वस्त | गिर गया Noida का Twin Tower,https://www.youtube.com/watch?v=Ay1g7DL07Sk,61K views,Streamed 1 day ago,News24,https://www.youtube.com/c/News24youtube
20,Rashtra Ki Baat | PM Modi के सामने टिक पाएंगे Nitish Kumar ? Manak Gupta I News24 LIVE,https://www.youtube.com/watch?v=mF_ouXWb3OU,392K views,Streamed 2 weeks ago,News24,https://www.youtube.com/c/News24youtube
21,Zee News LIVE TV: Manish Sisodia PNB Locker Searched | CBI | PNB | Dumka Girl Death Case | AAP,https://www.youtube.com/watch?v=0rlHRS0tSho,311 watching,NA,News24,https://www.youtube.com/c/News24youtube
22,सबसे बड़ा सवाल: Modi Vs Nitish या Modi Vs Kejriwal ? 2024 में विपक्ष एकजुट होगा? | Sandeep Chaudhari,https://www.youtube.com/watch?v=KwhYK1xn4Lg,413K views,Streamed 8 days ago,News24,https://www.youtube.com/c/News24youtube
23,आखिर क्यों गिराया गया Twin Tower? जानिए कैसे घर का सपना बन गया भ्रष्टाचार का अड्डा?,https://www.youtube.com/watch?v=8myB7qvmc5Q,115K views,1 day ago,News24,https://www.youtube.com/c/News24youtube
24,Rashtra Ki Baat : 'मुफ्त की रेवड़ी' पर Sudhanshu Trivedi Vs Sanjay Singh ? देखिये Manak Gupta के साथ,https://www.youtube.com/watch?v=eILT9XrQ_kw,754K views,Streamed 2 weeks ago,News24,https://www.youtube.com/c/News24youtube
25,വാർത്താസന്ധ്യ | 28 August 2022 | 24 News,https://www.youtube.com/watch?v=xoR170fRmq8,23K views,1 day ago,24 News,https://www.youtube.com/c/24OnLive
26,सरकार जाएगी या CM बदलेगा? क्या बोली Jharkhand की जनता? Ranchi से माहौल क्या है? Rajeev Ranjan के साथ,https://www.youtube.com/watch?v=V5cBFCJEBfQ,13K views,Streamed 4 days ago,News24,https://www.youtube.com/c/News24youtube
27,24 News Live TV | Malayalam News Live | HD Live news | Twentyfour News,https://www.youtube.com/watch?v=pJ4hrq3VXFk,6.9K watching,NA,News24,https://www.youtube.com/c/News24youtube
28,News24 Nepal LIVE,https://www.youtube.com/watch?v=IHNSPmvwDY8,31 watching,NA,News24,https://www.youtube.com/c/News24youtube
29,'मैं और मेरे विधायक कट जाएंगे लेकिन देश के साथ दगा नहीं करेंगे'- राजघाट पर बोले Arvind Kejriwal,https://www.youtube.com/watch?v=fn_Jc1fBnxE,222K views,Streamed 4 days ago,News24,https://www.youtube.com/c/News24youtube
30,Rashtra Ki Baat: विपक्ष की एक और सरकार खतरे में ? Manak Gupta I Jharkhand I Hemant Soren I LIVE,https://www.youtube.com/watch?v=BfsPfkj5cKU,329K views,Streamed 3 days ago,News24,https://www.youtube.com/c/News24youtube
31,WATCH | Armed robbers stop and rob motorists on N2,https://www.youtube.com/watch?v=A_8nGXBfanw,14K views,3 days ago,News24,https://www.youtube.com/user/News24Video
32,FRANCE 24 English – LIVE – International Breaking News & Top stories - 24/7 stream,https://www.youtube.com/watch?v=h3MuIUNCCzI,1.7K watching,NA,News24,https://www.youtube.com/user/News24Video
33,Siasat ki khabrein 24th Aug 2022,https://www.youtube.com/watch?v=jnVEKSJbDBU,485K views,6 days ago,Siasat Daily,https://www.youtube.com/c/SiasatDailyNews
34,ഉച്ചവാർത്ത | 26 August 2022 | 24 News,https://www.youtube.com/watch?v=7a5quVmEPKg,9.8K views,4 days ago,24 News,https://www.youtube.com/c/24OnLive
35,7 AM News Headlines | Hindi News | Latest News | Top News | Today's News | News24,https://www.youtube.com/watch?v=BewAw4cRwl8,26K views,1 day ago,News24,https://www.youtube.com/c/News24youtube
36,ABP Majha LIVE TV | Mumbai Metro 3 | Ganeshotsav 2022 | Maharashtra Politics | Marathi News 24/7,https://www.youtube.com/watch?v=Rs3GfkHRwXA,2K watching,NA,News24,https://www.youtube.com/c/News24youtube
37,Kaalchakra:अपनी कुंडली खोलिए और खुद जानिए..अपने आज और कल की भविष्यवाणी.. Pt. Suresh Pandey ji के साथ,https://www.youtube.com/watch?v=6n7WYafKWTc,21K views,Streamed 3 days ago,News24,https://www.youtube.com/c/News24youtube
38,आम लोगों ने कैसे मनाया अमृत महोत्सव ? माहौल क्या है ? Rajeev Ranjan के साथ,https://www.youtube.com/watch?v=0Rys3RSqoMA,213K views,Streamed 2 weeks ago,News24,https://www.youtube.com/c/News24youtube
39,LIVE NEWS | ലൈവ് ന്യൂസ് | 30 August 2022 | 24 News,https://www.youtube.com/watch?v=VXGD2q7dGYs,1.1K views,2 hours ago,24 News,https://www.youtube.com/c/24OnLive
40,1 PM News Bulletin | 25 Aug 2022 | Hindi News | Latest News | Today's News || News24,https://www.youtube.com/watch?v=Gfk_mmm0C5E,8.4K views,Streamed 5 days ago,News24,https://www.youtube.com/c/News24youtube
41,Rashtra Ki Baat: देश में बंद होने वाला है ‘मुफ्त कल्चर’ ? Manak Gupta के साथ I News24 LIVE,https://www.youtube.com/watch?v=f6FA5Bz_T6Y,219K views,Streamed 2 weeks ago,News24,https://www.youtube.com/c/News24youtube
42,Noida Twin Tower Demolition LIVE | सबसे बड़ा धमाका | भ्रष्टाचार की इमारत का नाश | Breaking News,https://www.youtube.com/watch?v=MHbbqO5ydLU,331K views,Streamed 2 days ago,News24,https://www.youtube.com/c/News24youtube
43,"Jharkhand में महागठबंधन में सेंधमार बहुत मुश्किल, BJP वेट एंड वॉच की भूमिका में ! माहौल क्या है?",https://www.youtube.com/watch?v=GqALyKRHzKM,205K views,Streamed 3 days ago,News24,https://www.youtube.com/c/News24youtube
44,8 बजे 18 Prime News | Hindi News | Latest News | Top News | Today's News | News24,https://www.youtube.com/watch?v=fqelNF31yq8,6.4K views,Streamed 3 days ago,News24,https://www.youtube.com/c/News24youtube
45,"News24 LIVE: संकट में Jharkhand सरकार, 3 बसों में 39 विधायक Chandigarh के लिए निकले ! Hemant Soren",https://www.youtube.com/watch?v=qtGWZ-YWCpc,531K views,Streamed 3 days ago,News24,https://www.youtube.com/c/News24youtube
46,"सबसे बड़ा सवाल : शराब पर हंगामा क्यों है बरपा ? किसने की चोरी, किसने डाला डाका ? संदीप चौधरी के साथ",https://www.youtube.com/watch?v=vrby3ld7WZg,171K views,Streamed 3 weeks ago,News24,https://www.youtube.com/c/News24youtube
47,सबसे बड़ा सवाल- बंट गए किसान…कैसे होगा कल्याण ? देखिए Sandeep Chaudhary के साथ LIVE,https://www.youtube.com/watch?v=dm6-0fZA47o,375K views,Streamed 6 days ago,News24,https://www.youtube.com/c/News24youtube
48,'15 साल के बाद अब CBI जागी है'- Tejashwi Yadav ने प्रेस कॉन्फ्रेंस कर BJP पर लगाए गंभीर आरोप,https://www.youtube.com/watch?v=Zwlpv66mZ0Q,372K views,Streamed 4 days ago,News24,https://www.youtube.com/c/News24youtube
49,আওয়ামী লীগ-বিএনপির দফায় দফায় সংঘর্ষে আহত অন্তত ৩০ | Channel 24,https://www.youtube.com/watch?v=eFvCuVuuvoU,582K views,2 days ago,Channel 24,https://www.youtube.com/c/channel24digital
50,പാർട്ടി ഓഫീസ് ക്വട്ടേഷൻ | Encounter | 27 August 2022 | 24 NEWS,https://www.youtube.com/watch?v=kmFGftphDNw,16K views,2 days ago,24 News,https://www.youtube.com/c/24OnLive
51,Rashtra Ki Baat: लाल किले से PM ने किस पर साधा निशाना ? 75 साल बाद ‘विभाजन’ पर घमासान क्यों ?,https://www.youtube.com/watch?v=Owxj0kLSXxQ,93K views,Streamed 2 weeks ago,News24,https://www.youtube.com/c/News24youtube
52,सबसे बड़ा सवाल- भारत को श्रीलंका से सबक लेने की जरूरत ? देखिए Sandeep Chaudhary के साथ LIVE,https://www.youtube.com/watch?v=CquWmbiGctk,400K views,Streamed 1 month ago,News24,https://www.youtube.com/c/News24youtube
53,2024 में कैसे लड़ेंगे अखिलेश ? 'सपा' अध्यक्ष Akhilesh Yadav का इंटरव्यू 'EXCLUSIVE' I News24 LIVE,https://www.youtube.com/watch?v=NAidmpSssog,67K views,Streamed 1 day ago,News24,https://www.youtube.com/c/News24youtube
54,8 AM 18 Breaking News | Hindi News | Latest News | Top News | Today's News | News24,https://www.youtube.com/watch?v=vD8tNIkFHjA,6K views,Streamed 3 days ago,News24,https://www.youtube.com/c/News24youtube
55,"शराब पॉलिसी पर ना बोलने के लिए Kejriwal ने मुझे 5 करोड़ का ऑफर दिया: Shubhrastha, राजनीतिज्ञ",https://www.youtube.com/watch?v=JLHefL-HElQ,399K views,4 days ago,News24,https://www.youtube.com/c/News24youtube
56,"IND Vs PAK: Rohit-Rahul का छक्कों से ऐलान, पाकिस्तान को जाओ सावधान- देखिए प्रेक्टिस की live कवरेज",https://www.youtube.com/watch?v=SU4pdFkKmQk,150K views,4 days ago,News24 Sports,https://www.youtube.com/c/News24Sports
57,किसानों के धरने से Rakesh Tikait की दूरी क्यों ? Rajeev Ranjan के साथ माहौल क्या है?,https://www.youtube.com/watch?v=-4eZYtjTDRw,239K views,Streamed 7 days ago,News24,https://www.youtube.com/c/News24youtube
58,Bihar के उपमुख्यमंत्री बनने के बाद Tejashwi Yadav का Exclusive Interview | Tejashwi Yadav Live,https://www.youtube.com/watch?v=aAzjAj8IBXc,274K views,Streamed 2 weeks ago,News24,https://www.youtube.com/c/News24youtube
59,"जब हम 2024 में 70 सीटें लाएंगे तो अखिलेश यादव 'PM' दावेदार होंगे: Anurag bhadouria, SP",https://www.youtube.com/watch?v=CPPuD_-_q10,67K views,21 hours ago,News24,https://www.youtube.com/c/News24youtube
60,AAP MP Sanjay Singh का BJP पर बड़ा आरोप कहा- 4 विधायकों को 20-20 करोड़ रुपये की पेशकश की,https://www.youtube.com/watch?v=gKsC_eBz-GA,282K views,Streamed 5 days ago,News24,https://www.youtube.com/c/News24youtube
61,Sabse Bada Sawal : Bilkis को 'अधूरा' इन्साफ ? नारी का सम्मान या दोषी का 'गुणगान'? संदीप चौधरी के साथ,https://www.youtube.com/watch?v=TGTBxz--Gvg,416K views,Streamed 4 days ago,News24,https://www.youtube.com/c/News24youtube
62,ചൈനയുടെ ചിപ്പ് ഊരാൻ അമേരിക്ക | 24 News,https://www.youtube.com/watch?v=MDeZh9cfETk,95K views,6 days ago,24 News,https://www.youtube.com/c/24OnLive
63,"Ghulam Nabi Azad ने कहा- महंगाई बेरोजगारी पर बात करते, 'चौकीदार चोर है' फ्लॉप रहा",https://www.youtube.com/watch?v=Ug0Rh0wzCLs,7.5K views,Streamed 1 hour ago,News24,https://www.youtube.com/c/News24youtube
64,आठ बार के BJP MP और डिप्टी स्पीकर रहे Kariya Munda गांव में रहने को मजबूर हैं ? Rajeev Ranjan के साथ,https://www.youtube.com/watch?v=TKYP1xmowJw,226K views,9 hours ago,News24,https://www.youtube.com/c/News24youtube
65,सबसे बड़ा सवाल- TV देश को भड़का रहा है? Sandeep Chaudhary के साथ LIVE,https://www.youtube.com/watch?v=yCMi9H1ayTU,492K views,Streamed 1 month ago,News24,https://www.youtube.com/c/News24youtube
66,Sabse Bada Sawal | Sandeep Chaudhari के साथ Asaduddin Owaisi EXCLUSIVE,https://www.youtube.com/watch?v=gUe0RelLD4Q,218K views,Streamed 13 days ago,News24,https://www.youtube.com/c/News24youtube
67,सबसे बड़ा सवाल: मैं दलित हूं…मैं आज़ाद हूं ! देश से जातिवाद कब खत्म होगा ? Sandeep Chaudhari के साथ,https://www.youtube.com/watch?v=4marKV2ilWQ,86K views,Streamed 2 weeks ago,News24,https://www.youtube.com/c/News24youtube
68,"News24 LIVE: संकट में Jharkhand सरकार, मुसीबत में CM सोरेन । Hemant Soren",https://www.youtube.com/watch?v=JkAyVF08ryc,66K views,Streamed 3 days ago,News24,https://www.youtube.com/c/News24youtube
69,Rakesh Tikait को उठा ले गई Delhi Police! गुस्साए टिकैत ने दी 'नई क्रांति' की चुनौती!,https://www.youtube.com/watch?v=nOCtHTITJuU,258K views,8 days ago,News24,https://www.youtube.com/c/News24youtube
70,11 AM 11 Breaking News | Hindi News | Latest News | Top News | Today's News | News24,https://www.youtube.com/watch?v=x7TkmFUvQYc,5.8K views,Streamed 3 days ago,News24,https://www.youtube.com/c/News24youtube
71,Kanak News Live 24*7 |Supertech Twin Towers Demolition | Odia News Updates | Latest News Update,https://www.youtube.com/watch?v=P2yfFoDafIk,71 watching,NA,News24,https://www.youtube.com/c/News24youtube
72,Manish Sisodia के घर छापे पर क्या कहती है Delhi की जनता? देखिये Rajiv Ranjan के साथ माहौल क्या है ?,https://www.youtube.com/watch?v=j2RPgagBxEA,1.3M views,Streamed 10 days ago,News24,https://www.youtube.com/c/News24youtube
73,Rashtra Ki Baat | Congress से क्यों 'आजाद' हुए गुलाम? | Manak Gupta | Ghulam Nabi Azad | Congress,https://www.youtube.com/watch?v=xn5QRlh7_Xs,97K views,Streamed 3 days ago,News24,https://www.youtube.com/c/News24youtube
74,GULF FOCUS | ഗൾഫ് വാർത്തകൾ | 26 August 2022 | 24 News,https://www.youtube.com/watch?v=qi9mkw0rVgU,5.6K views,3 days ago,24 News,https://www.youtube.com/c/24OnLive
75,सुबह 8 बजे की 18 Breaking News || 24 Aug 2022 || Today's News || News24,https://www.youtube.com/watch?v=ytf3FjIFuOs,7.3K views,6 days ago,News24,https://www.youtube.com/c/News24youtube
76,"Kejriwal विधायकों के साथ पहुंचे राजघाट, BJP बोली सच छुपने वाला नहीं है- Sudhanshu Trivedi की PC LIVE",https://www.youtube.com/watch?v=iX_RYGc0ab4,25K views,Streamed 5 days ago,News24,https://www.youtube.com/c/News24youtube
77,"BJP बोली केजरीवाल सरकार भ्रष्ट, AAP बोली 2024 में हैं मोदी के विकल्प ! क्या बोली दिल्ली की जनता",https://www.youtube.com/watch?v=9hQaQpyTX2Y,615K views,Streamed 9 days ago,News24,https://www.youtube.com/c/News24youtube
78,Rashtra Ki Baat | डिप्टी CM के घर CBI... घोटाला या 'सियासी' लड़ाई ? देखिए Manak Gupta के साथ LIVE,https://www.youtube.com/watch?v=UKCyoFaP-LM,169K views,Streamed 11 days ago,News24,https://www.youtube.com/c/News24youtube
79,🔴 BOL NEWS LIVE | Latest Pakistan News 24/7 | Headlines Bulletins Breaking News & Exclusive Coverage,https://www.youtube.com/watch?v=ZCxFeUXH3rg,5.8K watching,NA,News24,https://www.youtube.com/c/News24youtube
80,'इतनी गर्मी में BJP क्यों कंपकपा रही है'?- Kanhaiya Kumar ने बीजेपी पर बोला हमला,https://www.youtube.com/watch?v=sT8VEK7HZTs,628K views,13 days ago,News24,https://www.youtube.com/c/News24youtube
81,"Arvind Kejriwal अपनी लाइन खींचना चाहते हैं, वे विपक्ष के साथ नहीं जाना चाहते हैं: Sukesh Ranjan",https://www.youtube.com/watch?v=K6H-S8uZQFA,121K views,8 days ago,News24,https://www.youtube.com/c/News24youtube
82,"PM मोदी Vs अखिलेश 'Contest' 2024 में हो ही नहीं सकता है: Ashok Wankhede, वरिष्ठ पत्रकार",https://www.youtube.com/watch?v=cgRhBvKE_U0,77K views,22 hours ago,News24,https://www.youtube.com/c/News24youtube
83,"Modi Government से क्या चाहते हैं Varun Gandhi? THE INSIDE STORY । Sukesh Ranjan, Himanshu Mishra",https://www.youtube.com/watch?v=BJpDybhLsjg,129K views,7 days ago,News24,https://www.youtube.com/c/News24youtube
84,‘Good Morning with 100 News || 26 Aug 2022 | Hindi News | Latest News || News24,https://www.youtube.com/watch?v=MytSO3zsMy4,2.9K views,4 days ago,News24,https://www.youtube.com/c/News24youtube
85,Good Morning India || 28 Aug 2022 | Hindi News | Latest News || News24,https://www.youtube.com/watch?v=qmzZGm3JXH4,2.2K views,2 days ago,News24,https://www.youtube.com/c/News24youtube
86,‘Good Morning with Top 50 || 27 Aug 2022 | Hindi News | Latest News || News24,https://www.youtube.com/watch?v=knzWA31Wql8,14K views,Streamed 3 days ago,News24,https://www.youtube.com/c/News24youtube
87,"DNA: Non-Stop News; August 24, 2022 | Top News | Hindi News | Nonstop Speed News | Nitish Kumar",https://www.youtube.com/watch?v=g4lnlQIG4ak,73K views,5 days ago,Zee News,https://www.youtube.com/c/zeenews
88,हर तरफ गरजेगा Vikrant…China-Pakistan भयाक्रांत ! ‘विक्रांत’ के डेक से EXCLUSIVE रिपोर्ट,https://www.youtube.com/watch?v=yYGBA59f7kg,9.1K views,Streamed 1 day ago,News24,https://www.youtube.com/c/News24youtube
89,Maharashtra का सस्पेंस खत्म करेगा Supreme Court ?..शिवसेना ठाकरे की या शिंदे की? | Sandeep Chaudhary,https://www.youtube.com/watch?v=Oh-Rnhnb_FU,418K views,Streamed 1 month ago,News24,https://www.youtube.com/c/News24youtube
90,Jharkhand में ‘Soren संकट’ ! EC ने रद्द की CM Soren की विधानसभा सदस्यता…किसे सौंपेंगे सत्ता?,https://www.youtube.com/watch?v=yttrRQBnopI,24K views,Streamed 5 days ago,News24,https://www.youtube.com/c/News24youtube
91,EVENING NEWS FATAFAT - NEWS24 TV,https://www.youtube.com/watch?v=8iDciBrMN4s,14K views,21 hours ago,News24 Nepal,https://www.youtube.com/c/news24tvchannel
92,Rashtra Ki Baat : 24 में Modi के सामने कौन | Kejriwal | Mamata Banerjee | Nitish | Manak Gupta,https://www.youtube.com/watch?v=Zc8zLdHi2oc,516K views,Streamed 10 days ago,News24,https://www.youtube.com/c/News24youtube
93,4 बजे 24 रिपोर्टर | 23 Aug 2022 | Hindi News | Latest News | Today's News || News24,https://www.youtube.com/watch?v=Ehb-6yvWAOI,6.4K views,Streamed 7 days ago,News24,https://www.youtube.com/c/News24youtube
94,Lalu Prasad Yadav के बड़े बेटे को गुस्सा क्यों आता है ?... Rajeev Ranjan के साथ Tej Pratap Exclusive,https://www.youtube.com/watch?v=HLKYN0pvDDY,784K views,Streamed 2 weeks ago,News24,https://www.youtube.com/c/News24youtube
95,"सबसे बड़ा सवाल: महंगाई का जोर, लाउडस्पीकर पर शोर ! लाउडस्पीकर विवाद…फिजूल की बात ? LIVE",https://www.youtube.com/watch?v=suv-1UfE12o,131K views,Streamed 3 months ago,News24,https://www.youtube.com/c/News24youtube
96,News24 LIVE | Bihar Assembly Floor Test: Nitish Kumar LIVE,https://www.youtube.com/watch?v=fMHRr9pZkRc,115K views,Streamed 6 days ago,News24,https://www.youtube.com/c/News24youtube
97,Sabse Bada Sawal | China की गुस्ताखी का मिलेगा जवाब? देखिए Sandeep Chaudhary के साथ LIVE,https://www.youtube.com/watch?v=vpQMt8CgWRs,192K views,Streamed 2 days ago,News24,https://www.youtube.com/c/News24youtube
98,लालू परिवार से राघोपुर की जनता की क्या शिकायत? राघोपुर का माहौल क्या है ? Rajeev Ranjan के साथ LIVE,https://www.youtube.com/watch?v=weqMP6IHyb4,518K views,Streamed 2 weeks ago,News24,https://www.youtube.com/c/News24youtube
